name,summary,url,image_url,id,book_type,is_bt,bt_source,author_clean,author_num_books,author_num_followers,cred_score,author_bio,about_author,genres,problem_sentence,keywords,star_rating,num_ratings,num_reviews,first_published,year_published,usa_events,historical_context,publication_reason,currently_reading,want_to_read,community_reviews,kindle_price_clean,spectrum_clean,methodology_clean,tone_clean,style_clean,key_cat_primary,audience_cat,problem_cat,solution_cat,problem_origin
Every Man's Battle: Winning the War on Sexual Temptation One Victory at a Time,"the challenge every man faces...the fight every man can win

From the television to the Internet, print media to videos, men are constantly faced with the assault of sensual images. It is impossible to avoid such temptations...but, thankfully, not impossible to rise above them.
Shattering the perception that men are unable to control their thought lives and roving eyes, Every Man's Battle shares the stories of dozens who have escaped the trap of sexual immorality and presents a practical, detailed plan for any man who desires sexual purity-perfect for men who have fallen in the past, those who want to remain strong today, and all who want to overcome temptation in the future.




Includes a special section for women, designed to help them understand and support the men they love.",https://www.goodreads.com/book/show/49064.Every_Man_s_Battle,https://images-na.ssl-images-amazon.com/images/S/compressed.photo.goodreads.com/books/1388358813i/49064.jpg,49064.Every_Man_s_Battle,,,,Stephen Arterburn,245.0,147.0,3,"Stephen Arterburn is the founder and chairman of New Life Ministries—the nation's largest faith-based broadcast, counseling, and treatment ministry—and is the host of the nationally syndicated New Life Live! daily radio program aired on over 180 radio stations nationwide, Sirius XM radio, and on television. Steve is also the founder of the Women of Faith conferences, attended by over 4 million women, and of HisMatchforMe.com.
Steve is a nationally known public speaker and has been featured in national media venues such as , , , , the , , and & .
In August 2000, Steve was inducted into the National Speakers Association's Hall of Fame. A bestselling author, Steve has written more than one hundred books, including the popular series and his most recent book, . He is a Gold Medallion–winning author and has been nominated for numerous other writing awards.
Steve has degrees from Baylor University and the University of North Texas as well as two honorary doctorate degrees. Steve is a teaching pastor at Northview Church in suburban Indianapolis and resides with his family in Indiana.","{""name"":""Stephen Arterburn"",""num_books"":245,""num_followers"":""147""}","[""Christian"",""Nonfiction"",""Christian Living"",""Christianity"",""Self Help"",""Religion"",""Christian Non Fiction"",""Relationships"",""Spirituality"",""Sexuality""]",The book addresses the issue of men struggling with sexual purity and highlights the means to overcome such temptations.,"sexual purity, temptation, control, Christian living, relationships",3.89,6881.0,297.0,1/1/2000,2000,"September 11 Attacks (Terrorism) - Led to global War on Terror and significant changes in US policies. - Affected: American citizens, global citizens - Outcome: Negative; Oklahoma City Bombing (Domestic Terrorism) - Deadliest act of domestic terrorism in the US until 9/11, leading to 168 deaths. - Affected: American citizens - Outcome: Negative; Hurricane Katrina (Natural Disaster) - One of the deadliest hurricanes in US history, causing widespread destruction and loss of life. - Affected: Gulf Coast residents - Outcome: Negative; Enactment of the Patriot Act (Legislative) - Expanded surveillance powers postUnknown9/11, raising privacy concerns. - Affected: American citizens - Outcome: Mixed","Explosion of Internet Use (Mid 1990s - 2000)
Development of Online Pornography (Late 1990s - 2000)
Sexual Revolution (1960s-1980s)","Published in 2000 as the Internet’s rapid rise and the surge in online pornography began transforming media consumption, Every Man’s Battle was timely in offering men practical guidance to overcome increasingly prevalent digital temptations and maintain sexual purity.",579.0,2794.0,"{""1_stars"":{""reviews_num"":326,""reviews_percentage"":4},""2_stars"":{""reviews_num"":419,""reviews_percentage"":6},""3_stars"":{""reviews_num"":1452,""reviews_percentage"":21},""4_stars"":{""reviews_num"":2177,""reviews_percentage"":31},""5_stars"":{""reviews_num"":2507,""reviews_percentage"":36}}",14.99,Spiritual/Religious,Experiential,Pragmatic/Practical,Instructional,Underachievement & Stalled Potential,Individuals Exploring Spiritual & Existential Issues,Self-Defeating Behaviors & Mindsets,Spiritual & Existential Approaches,INTERNAL
The Elements of Eloquence: How to Turn the Perfect English Phrase,"The idiosyncratic, erudite and brilliantly funny new book from Mark Forsyth, bestselling author of The Etymologicon and The Horologicon.

In an age unhealthily obsessed with substance, this is a book on the importance of pure style.

From classic poetry to pop lyrics and from the King James Bible to advertising slogans, Mark Forsyth explains the secrets that make a phrase - such as ‘Tiger, tiger, burning bright’ or ‘To be or not to be’ - memorable.

In his inimitably entertaining and witty style he takes apart famous lines and shows how you too can write like Shakespeare or Oscar Wilde. Whether you’re aiming for literary immortality or just an unforgettable one-liner, The Elements of Eloquence proves that you don't need to have anything to say - you simply need to say it well.",https://www.goodreads.com/book/show/17415726-the-elements-of-eloquence,https://images-na.ssl-images-amazon.com/images/S/compressed.photo.goodreads.com/books/1381488044i/17415726.jpg,17415726-the-elements-of-eloquence,,,,Mark Forsyth,15.0,817.0,3,"Mark Forsyth is a writer, journalist and blogger. Every job he’s ever had, whether as a ghost-writer or proof-reader or copy-writer, has been to do with words. He started The Inky Fool blog in 2009 and now writes a post almost every day. The blog has received worldwide attention and enjoys an average of 4,000 hits per week.

Mr. Forsyth currently resides in London.","{""name"":""Mark Forsyth"",""num_books"":15,""num_followers"":""817""}","[""Nonfiction"",""Writing"",""Language"",""Linguistics"",""Reference"",""Audiobook"",""Communication"",""Self Help"",""Education"",""Literature""]","The book addresses the challenge of mastering the art and style of written and spoken language to create memorable and eloquent phrases, regardless of substance or content.","Written and spoken language, eloquence, memorable phrases, style over substance, language mastery.",4.35,6599.0,917.0,11/7/2013,2013,"Black Lives Matter Movement (Social Movement) - Movement against violence and systemic racism towards black people. - Affected: African American community - Outcome: Positive; Supreme Court Upholds Obamacare (Judicial) - Affirmed the constitutionality of the Affordable Care Act, ensuring continued health coverage. - Affected: American citizens - Outcome: Positive; USUnknownMexico Border Wall Expansion (Political/Infrastructure) - Controversial project aimed at curbing illegal immigration and trafficking. - Affected: Migrants, American citizens - Outcome: Mixed; SameUnknownSex Marriage Legalization (Legal) - Supreme Court legalized sameUnknownsex marriage, a landmark decision. - Affected: LGBTQ+ community, citizens - Outcome: Positive; #MeToo Movement (Social Movement) - Movement against sexual harassment and assault, sparking global conversations. - Affected: Survivors, general public - Outcome: Positive; Hurricane Sandy (Natural Disaster) - Devastating hurricane causing extensive damage and highlighting climate risks. - Affected: East Coast residents - Outcome: Negative; Affordable Care Act (Obamacare) Implementation (Healthcare) - Implementation of the Affordable Care Act aimed at improving healthcare access. - Affected: American citizens - Outcome: Positive; Housing Market Crash and Great Recession (Economic) - Triggered global financial crisis, leading to widespread economic hardship. - Affected: Homeowners, global economy - Outcome: Negative; Charlottesville Rally and Violence (Social Unrest) - Highlighted racial tensions and sparked national debate on hate groups. - Affected: General public, activists - Outcome: Negative; US Recognition of Jerusalem as Israel's Capital (International Policy) - Shifted US foreign policy, leading to global reactions and tensions. - Affected: International community - Outcome: Mixed","Digital Revolution (ongoing since 1950s)
Internet boom (1990s-2000s)
Rise of Social Media (2004 onwards)",Published in 2013 as America was reeling from transformative events—such as the Supreme Court’s upholding of Obamacare and the burgeoning momentum of the Black Lives Matter movement—Forsyth's book celebrates the power of sparkling language to cut through the noise of a tumultuous era.,1361.0,141.0,"{""1_stars"":{""reviews_num"":35,""reviews_percentage"":0},""2_stars"":{""reviews_num"":102,""reviews_percentage"":1},""3_stars"":{""reviews_num"":735,""reviews_percentage"":11},""4_stars"":{""reviews_num"":2344,""reviews_percentage"":35},""5_stars"":{""reviews_num"":3383,""reviews_percentage"":51}}",9.99,Spiritual/Religious,Anecdotal,Humorous,Case Study Compilation,Underachievement & Stalled Potential,Individuals Exploring Spiritual & Existential Issues,Self-Defeating Behaviors & Mindsets,Cognitive & Behavioral Techniques,INTERNAL
"The Saint, the Surfer, and the CEO: A Remarkable Story about Living Your Heart's Desires","Once in a while, a book comes along that has the power and the wisdom to speak to the best part of us and awaken our highest selves to the miracle our lives were meant to be. In this truly unforgettable guide, Robin Sharma, author of the national bestseller The Monk Who Sold His Ferrari and a man whose life lessons are currently transforming the lives of many thousands of people across the planet, will show you how to access your inner gifts and reshape your whole outer life in the process. With brilliant simplicity and remarkable insight, The Saint, the Surfer and the CEO will teach you:
• How to stop betraying your self and live your destiny
• Simple ways to feel a rare amount of fulfillment and joy in your days  
• How to reconnect to your inner child like heart for a more passion-filled life
• Lessons to conquer stress, balance life, and feel good about yourself
• A proven process that will revolutionize your relationships and fill your life with love
• How to restore adventure, simplicity, and prosperity into your life
• Powerful principles to become strikingly successful at work
• Practical wisdom to help see a gorgeous vision for your future and then make it a reality",https://www.goodreads.com/book/show/289030.The_Saint_the_Surfer_and_the_CEO,https://images-na.ssl-images-amazon.com/images/S/compressed.photo.goodreads.com/books/1347372844i/289030.jpg,289030.The_Saint_the_Surfer_and_the_CEO,,,,Robin S. Sharma,282.0,6259.0,,"Robin Sharma is one of the world’s premier thinkers on leadership, personal growth and life management. The bestselling author of
The Monk Who Sold His Ferrari,
Who Will Cry When You Die? and
The Saint, the Surfer, and the CEO and four other books on self-transformation.","{""name"":""Robin S. Sharma"",""num_books"":282,""num_followers"":""6259""}","[""Self Help"",""Nonfiction"",""Personal Development"",""Business"",""Spirituality"",""Philosophy"",""Psychology"",""Leadership"",""Inspirational"",""Unfinished""]","This book addresses the issue of unfulfilled potential in personal and professional life, as well as guiding ways to overcome self-betrayal, reach balance, and develop a more fulfilling, adventurous, and prosperous life.","Self-betrayal, Life Balance, Unfulfilled Potential, Personal Fulfillment, Professional Success",4.04,6437.0,553.0,1/1/2002,2002,"September 11 Attacks (Terrorism) - Led to global War on Terror and significant changes in US policies. - Affected: American citizens, global citizens - Outcome: Negative; Hurricane Katrina (Natural Disaster) - One of the deadliest hurricanes in US history, causing widespread destruction and loss of life. - Affected: Gulf Coast residents - Outcome: Negative; Enactment of the Patriot Act (Legislative) - Expanded surveillance powers postUnknown9/11, raising privacy concerns. - Affected: American citizens - Outcome: Mixed","Dot-com Bubble Burst (2000-2002)
September 11 Attacks (2001)","Published in the aftermath of the September 11 attacks and the dot-com bubble burst—periods marked by global uncertainty and a search for personal meaning—this book provided a timely guide for individuals seeking to rediscover their inner potential and achieve a balanced, fulfilling life.",843.0,5568.0,"{""1_stars"":{""reviews_num"":104,""reviews_percentage"":1},""2_stars"":{""reviews_num"":383,""reviews_percentage"":5},""3_stars"":{""reviews_num"":1235,""reviews_percentage"":19},""4_stars"":{""reviews_num"":2171,""reviews_percentage"":33},""5_stars"":{""reviews_num"":2544,""reviews_percentage"":39}}",1.99,Spiritual/Religious,Experiential,Pragmatic/Practical,Instructional,Underachievement & Stalled Potential,Individuals Exploring Spiritual & Existential Issues,Self-Defeating Behaviors & Mindsets,Spiritual & Existential Approaches,INTERNAL
"Swim with the Sharks Without Being Eaten Alive: Outsell, Outmanage, Outmotivate, and Outnegotiate Your Competition",This straight-from-the-hip handbook by bestselling author and self-made millionaire Harvey Mackay spells out the path to success for readers everywhere. They will learn how to:,https://www.goodreads.com/book/show/147746.Swim_with_the_Sharks_Without_Being_Eaten_Alive,https://images-na.ssl-images-amazon.com/images/S/compressed.photo.goodreads.com/books/1347789612i/147746.jpg,147746.Swim_with_the_Sharks_Without_Being_Eaten_Alive,,,,Harvey MacKay,42.0,110.0,2,,"{""name"":""Harvey MacKay"",""num_books"":42,""num_followers"":""110""}","[""Business"",""Nonfiction"",""Self Help"",""Leadership"",""Management"",""Personal Development"",""Buisness"",""Finance"",""Psychology"",""Economics""]",The book addresses the challenge of achieving success in business and personal life using insightful techniques and strategies.,"Success, Business, Personal Development, Finance Management, Leadership",3.93,6001.0,146.0,1/1/1988,1988,"Challenger Space Shuttle Disaster (Space Exploration Disaster) - Space Shuttle Challenger broke apart shortly after launch, killing all seven crew members. - Affected: Astronauts, general public - Outcome: Negative; Fall of the Berlin Wall (International) - Symbolized the end of the Cold War and led to German reunification; significant US involvement. - Affected: Global population - Outcome: Positive; Tech Boom and DotUnknowncom Bubble (Economic) - Rapid growth in tech industry, followed by a market crash in 2000. - Affected: Tech companies, investors - Outcome: Mixed","Black Monday (1987)
Reaganomics (1981-1989)
Globalization/Advancements in Technology (1980s)","Published in 1988 amid the economic turbulence following Black Monday and the sweeping effects of Reaganomics, the book offered timely, no-nonsense strategies to help readers navigate a rapidly changing business and personal landscape.",249.0,4942.0,"{""1_stars"":{""reviews_num"":196,""reviews_percentage"":3},""2_stars"":{""reviews_num"":378,""reviews_percentage"":6},""3_stars"":{""reviews_num"":1273,""reviews_percentage"":21},""4_stars"":{""reviews_num"":1967,""reviews_percentage"":32},""5_stars"":{""reviews_num"":2187,""reviews_percentage"":36}}",14.99,Secular/Scientific,Anecdotal,Authoritative,Instructional,Underachievement & Stalled Potential,Individuals Experiencing Career & Financial Challenges,Financial & Career Hardships,Practical Life Management Methods,INTERNAL
A Creative Companion: How to Free Your Creative Spirit,"Writer, artist, free spirit, and self-described ""dangerous woman, "" SARK readsfrom her lovely, lighthearted book on becoming an artist. Guaranteed to bringa little magic into even the most sensible life.",https://www.goodreads.com/book/show/164862.A_Creative_Companion,https://images-na.ssl-images-amazon.com/images/S/compressed.photo.goodreads.com/books/1387735704i/164862.jpg,164862.A_Creative_Companion,"Journal, Poetry",,,S.A.R.K.,27.0,487.0,2,"SARK (a.k.a. Susan Ariel Rainbow Kennedy) is an American author and illustrator of self-help books. Five of her sixteen books have been national bestsellers, and she has sold more than two million copies of her books.","{""name"":""S.A.R.K."",""num_books"":27,""num_followers"":""487""}","[""Art"",""Self Help"",""Nonfiction"",""Writing"",""Inspirational"",""Spirituality"",""Reference"",""Poetry"",""Psychology"",""Journal""]","The challenge of cultivating creativity and embracing life's magical moments, even within a seemingly mundane existence.","Creativity, Self-expression, Embracing magic, Artistic pursuit, Unleashing potential.",4.02,5919.0,54.0,10/31/1991,1991,"Challenger Space Shuttle Disaster (Space Exploration Disaster) - Space Shuttle Challenger broke apart shortly after launch, killing all seven crew members. - Affected: Astronauts, general public - Outcome: Negative; Fall of the Berlin Wall (International) - Symbolized the end of the Cold War and led to German reunification; significant US involvement. - Affected: Global population - Outcome: Positive; Oklahoma City Bombing (Domestic Terrorism) - Deadliest act of domestic terrorism in the US until 9/11, leading to 168 deaths. - Affected: American citizens - Outcome: Negative; Tech Boom and DotUnknowncom Bubble (Economic) - Rapid growth in tech industry, followed by a market crash in 2000. - Affected: Tech companies, investors - Outcome: Mixed","Fall of the Berlin Wall in 1989
Gulf War in 1990-1991
Tiananmen Square Massacre in 1989
End of the Cold War in 1991
Economic Recession in 1990-1991
Exxon Valdez Oil Spill in 1989","In the wake of momentous global shifts—most notably the end of the Cold War, symbolized by the fall of the Berlin Wall, and the unsettling impact of the Gulf War—this book was published as a celebration of creativity and self-expression, offering readers a beacon of light and magic amid uncertain times.",16.0,2863.0,"{""1_stars"":{""reviews_num"":193,""reviews_percentage"":3},""2_stars"":{""reviews_num"":343,""reviews_percentage"":5},""3_stars"":{""reviews_num"":1101,""reviews_percentage"":18},""4_stars"":{""reviews_num"":1814,""reviews_percentage"":30},""5_stars"":{""reviews_num"":2468,""reviews_percentage"":41}}",,Spiritual/Religious,Anecdotal,Motivational/Inspirational,Narrative-Driven,Underachievement & Stalled Potential,Individuals Exploring Spiritual & Existential Issues,Self-Defeating Behaviors & Mindsets,Spiritual & Existential Approaches,INTERNAL
The Nerdist Way: How to Reach the Next Level,"Nerd superstar Chris Hardwick offers his fellow ""creative obsessives"" crucial information needed to come out on top in the current Nerd uprising. As a lifelong member of ""The Nerd Herd,"" as he calls it, Chris Hardwick has learned all there is to know about Nerds. Developing a system, blog, and podcasts, Hardwick shares hard-earned wisdom about turning seeming weakness into world-dominating strengths in the hilarious self-help book, The Nerdist Way . From keeping their heart rate below hummingbird levels to managing the avalanche of sadness that is their in-boxes; from becoming evil geniuses to attracting wealth by turning down work, Hardwick reveals the secrets that can help readers achieve their goals by tapping into their true nerdtastic selves. Here Nerds will learn how ",https://www.goodreads.com/book/show/10723227-the-nerdist-way,https://images-na.ssl-images-amazon.com/images/S/compressed.photo.goodreads.com/books/1327905067i/10723227.jpg,10723227-the-nerdist-way,"Memoir, Biography",,,Chris Hardwick,6.0,135.0,,,"{""name"":""Chris Hardwick"",""num_books"":6,""num_followers"":""135""}","[""Nonfiction"",""Self Help"",""Humor"",""Biography"",""Audiobook"",""Memoir"",""Comedy"",""Personal Development"",""Productivity"",""Psychology""]","The book tackles how individuals considered as ""nerds"" can utilize their perceived weaknesses as strengths to achieve success and manage modern life's complexities.","Nerd empowerment, success strategies, self-management, personal development, transforming weaknesses into strengths.",3.68,5805.0,449.0,11/1/2011,2011,"Black Lives Matter Movement (Social Movement) - Movement against violence and systemic racism towards black people. - Affected: African American community - Outcome: Positive; Supreme Court Upholds Obamacare (Judicial) - Affirmed the constitutionality of the Affordable Care Act, ensuring continued health coverage. - Affected: American citizens - Outcome: Positive; SameUnknownSex Marriage Legalization (Legal) - Supreme Court legalized sameUnknownsex marriage, a landmark decision. - Affected: LGBTQ+ community, citizens - Outcome: Positive; Hurricane Sandy (Natural Disaster) - Devastating hurricane causing extensive damage and highlighting climate risks. - Affected: East Coast residents - Outcome: Negative; Affordable Care Act (Obamacare) Implementation (Healthcare) - Implementation of the Affordable Care Act aimed at improving healthcare access. - Affected: American citizens - Outcome: Positive; Housing Market Crash and Great Recession (Economic) - Triggered global financial crisis, leading to widespread economic hardship. - Affected: Homeowners, global economy - Outcome: Negative","Rise of the Internet and Software Boom (1990s-2000s)
Global Financial Crisis (2007-2008)
Rapid Growth of Social Media Platforms (2000s-2010s) 
Bullying awareness campaigns (2000s-2010s)
Nerd Culture popularization in Media (2000s-2011)","Following the economic turmoil of the Great Recession and the explosion of digital culture reshaping social interactions, The Nerdist Way was published in 2011 to empower self-identified nerds to transform their unique traits into strengths for success in a rapidly evolving world.",,,"{""1_stars"":{""reviews_num"":303,""reviews_percentage"":5},""2_stars"":{""reviews_num"":516,""reviews_percentage"":8},""3_stars"":{""reviews_num"":1453,""reviews_percentage"":25},""4_stars"":{""reviews_num"":2019,""reviews_percentage"":34},""5_stars"":{""reviews_num"":1514,""reviews_percentage"":26}}",4.99,Secular/Scientific,Anecdotal,Humorous,Memoir/Biographical,Underachievement & Stalled Potential,Individuals Experiencing Career & Financial Challenges,Self-Defeating Behaviors & Mindsets,Practical Life Management Methods,INTERNAL
