name,summary,url,image_url,id,book_type,is_bt,bt_source,author_clean,author_num_books,author_num_followers,cred_score,author_bio,about_author,genres,problem_sentence,keywords,star_rating,num_ratings,num_reviews,first_published,year_published,usa_events,historical_context,publication_reason,currently_reading,want_to_read,community_reviews,kindle_price_clean,spectrum_clean,methodology_clean,tone_clean,style_clean,key_cat_primary,audience_cat,problem_cat,solution_cat,problem_origin
Outliers: by Malcolm Gladwell | The Story of Success | Summary & Takeaways,"Learn what sets high achievers apart -- from Bill Gates to the Beatles -- in this #1 bestseller from ""a singular talent"" (New York Times Book Review).

In this stunning book, Malcolm Gladwell takes us on an intellectual journey through the world of ""outliers""--the best and the brightest, the most famous and the most successful. He asks the question: what makes high-achievers different?
His answer is that we pay too much attention to what successful people are like, and too little attention to where they are from: that is, their culture, their family, their generation, and the idiosyncratic experiences of their upbringing. Along the way he explains the secrets of software billionaires, what it takes to be a great soccer player, why Asians are good at math, and what made the Beatles the greatest rock band.Brilliant and entertaining, Outliers is a landmark work that will simultaneously delight and illuminate.",https://www.goodreads.com/book/show/3228917-outliers,https://images-na.ssl-images-amazon.com/images/S/compressed.photo.goodreads.com/books/1344266315i/3228917.jpg,26196978-outliers,,,,Malcolm Gladwell,118.0,36119.0,,"Malcolm Timothy Gladwell is a Canadian journalist, author, and public speaker. He has been a staff writer for The New Yorker since 1996. He has published seven books. He is also the host of the podcast Revisionist History and co-founder of the podcast company Pushkin Industries.
Gladwell's writings often deal with the unexpected implications of research in the social sciences, such as sociology and psychology, and make frequent and extended use of academic work. Gladwell was appointed to the Order of Canada in 2011.","{""name"":""Malcolm Gladwell"",""num_books"":118,""num_followers"":""36119""}","[""Nonfiction"",""Psychology"",""Business"",""Self Help"",""Sociology"",""Science"",""Audiobook"",""Personal Development"",""Leadership"",""Economics""]","The book addresses the often overlooked impact of personal background, upbringing, and societal factors on the creation and development of high-achievers and successful individuals.","Success factors, personal background, societal impact, upbringing, high-achievers.",4.19,794964.0,32831.0,11/18/2008,2008,"Hurricane Katrina (Natural Disaster) - One of the deadliest hurricanes in US history, causing widespread destruction and loss of life. - Affected: Gulf Coast residents - Outcome: Negative; Black Lives Matter Movement (Social Movement) - Movement against violence and systemic racism towards black people. - Affected: African American community - Outcome: Positive; Supreme Court Upholds Obamacare (Judicial) - Affirmed the constitutionality of the Affordable Care Act, ensuring continued health coverage. - Affected: American citizens - Outcome: Positive; Hurricane Sandy (Natural Disaster) - Devastating hurricane causing extensive damage and highlighting climate risks. - Affected: East Coast residents - Outcome: Negative; Affordable Care Act (Obamacare) Implementation (Healthcare) - Implementation of the Affordable Care Act aimed at improving healthcare access. - Affected: American citizens - Outcome: Positive; Housing Market Crash and Great Recession (Economic) - Triggered global financial crisis, leading to widespread economic hardship. - Affected: Homeowners, global economy - Outcome: Negative","Global Financial Crisis (2008)
War on Terror (2001- ongoing)
The Internet Boom and Dotcom Bubble (1995-2001)
Globalization and the expansion of neoliberal policies (1990s-2000s)
Movement for equal rights and opportunities (Women's rights, Civil rights, LGBT rights, etc) (1960s- ongoing)
The rise of digital and social media (early 2000s- ongoing)",,306.0,672.0,"{""1_stars"":{""reviews_num"":10387,""reviews_percentage"":1},""2_stars"":{""reviews_num"":24224,""reviews_percentage"":3},""3_stars"":{""reviews_num"":115655,""reviews_percentage"":14},""4_stars"":{""reviews_num"":297076,""reviews_percentage"":37},""5_stars"":{""reviews_num"":347622,""reviews_percentage"":43}}",12.99,Secular/Scientific,Experiential,Authoritative,Case Study Compilation,Underachievement & Stalled Potential,,,,EXTERNAL
The New Drawing on the Right Side of the Brain,"When Drawing on the Right Side of the Brain was first published in 1979, it hit the New York Times bestseller list within two weeks and stayed there for more than a year. In 1989, when Dr. Betty Edwards revised the book, it went straight to the Times list again. Now Dr. Edwards celebrates the twentieth anniversary of her classic book with a second revised edition.Over the last decade, Dr. Edwards has refined her material through teaching hundreds of workshops and seminars. Truly The New Drawing on the Right Side of the Brain, this edition includes:


the very latest developments in brain research
new material on using drawing techniques in the corporate world and in education
instruction on self-expression through drawing
an updated section on using color
detailed information on using the five basic skills of drawing for problem solving",https://www.goodreads.com/book/show/627206.The_New_Drawing_on_the_Right_Side_of_the_Brain,https://images-na.ssl-images-amazon.com/images/S/compressed.photo.goodreads.com/books/1348133732i/627206.jpg,627206.The_New_Drawing_on_the_Right_Side_of_the_Brain,,,,Betty Edwards,51.0,469.0,4,,"{""name"":""Betty Edwards"",""num_books"":51,""num_followers"":""469""}","[""Art"",""Nonfiction"",""Drawing"",""Reference"",""Psychology"",""Self Help"",""Design"",""Education"",""How To"",""Art Design""]","The book addresses the challenge of understanding and utilizing the brain's capability for enhancing drawing skills, using this as a means for self-expression, problem-solving and a tool in modern corporate and educational environments.","Drawing skills, Brain research, Self-expression, Corporate applications, Education.",3.87,357482.0,1007.0,1/1/1979,1979,,"Modernist Movement in Art (late 19th century - early 20th century)

Cold War (1947-1991)

Space Race (1955-1972)

Civil Rights Movement in the USA (1954-1968)

Globalization Increase (1970s - ongoing) 

Expansion of Corporate Culture (1970s-ongoing)

Technological revolution (Late 1970s - ongoing)

Educational Reform Movement (Late 1970s - ongoing)","Published in 1979, When Drawing on the Right Side of the Brain emerged as educational reform and the technological revolution sparked new, brain-based approaches to creativity and problem-solving in both academic and corporate settings.",6522.0,296.0,"{""1_stars"":{""reviews_num"":27117,""reviews_percentage"":7},""2_stars"":{""reviews_num"":25636,""reviews_percentage"":7},""3_stars"":{""reviews_num"":65042,""reviews_percentage"":18},""4_stars"":{""reviews_num"":87256,""reviews_percentage"":24},""5_stars"":{""reviews_num"":152431,""reviews_percentage"":42}}",11.99,Secular/Scientific,Research-based,Authoritative,Instructional,Underachievement & Stalled Potential,Individuals Experiencing Career & Financial Challenges,Self-Defeating Behaviors & Mindsets,Cognitive & Behavioral Techniques,INTERNAL
"David and Goliath: Underdogs, Misfits, and the Art of Battling Giants","In his #1 bestselling books The Tipping Point, Blink, and Outliers, Malcolm Gladwell has explored the ways we understand and change our world. Now he looks at the complex and surprising ways the weak can defeat the strong, the small can match up against the giant, and how our goals (often culturally determined) can make a huge difference in our ultimate sense of success. Drawing upon examples from the world of business, sports, culture, cutting-edge psychology, and an array of unforgettable characters around the world, David and Goliath is in many ways the most practical and provocative book Malcolm Gladwell has ever written.",https://www.goodreads.com/book/show/15751404-david-and-goliath,https://images-na.ssl-images-amazon.com/images/S/compressed.photo.goodreads.com/books/1391813567i/15751404.jpg,15751404-david-and-goliath,,,,Malcolm Gladwell,118.0,36116.0,,"Malcolm Timothy Gladwell is a Canadian journalist, author, and public speaker. He has been a staff writer for The New Yorker since 1996. He has published seven books. He is also the host of the podcast Revisionist History and co-founder of the podcast company Pushkin Industries.
Gladwell's writings often deal with the unexpected implications of research in the social sciences, such as sociology and psychology, and make frequent and extended use of academic work. Gladwell was appointed to the Order of Canada in 2011.","{""name"":""Malcolm Gladwell"",""num_books"":118,""num_followers"":""36116""}","[""Nonfiction"",""Psychology"",""Business"",""Audiobook"",""Self Help"",""Sociology"",""Science"",""Leadership"",""History"",""Personal Development""]","The book addresses how smaller, weaker entities can defeat larger, stronger opponents, focusing on how our culturally-determined goals can greatly influence our overall sense of success.","Power dynamics, Cultural influences, Perception of success, Underdog victory, Goal setting",3.97,182580.0,11569.0,10/1/2013,2013,"Black Lives Matter Movement (Social Movement) - Movement against violence and systemic racism towards black people. - Affected: African American community - Outcome: Positive; Supreme Court Upholds Obamacare (Judicial) - Affirmed the constitutionality of the Affordable Care Act, ensuring continued health coverage. - Affected: American citizens - Outcome: Positive; USUnknownMexico Border Wall Expansion (Political/Infrastructure) - Controversial project aimed at curbing illegal immigration and trafficking. - Affected: Migrants, American citizens - Outcome: Mixed; SameUnknownSex Marriage Legalization (Legal) - Supreme Court legalized sameUnknownsex marriage, a landmark decision. - Affected: LGBTQ+ community, citizens - Outcome: Positive; #MeToo Movement (Social Movement) - Movement against sexual harassment and assault, sparking global conversations. - Affected: Survivors, general public - Outcome: Positive; Hurricane Sandy (Natural Disaster) - Devastating hurricane causing extensive damage and highlighting climate risks. - Affected: East Coast residents - Outcome: Negative; Affordable Care Act (Obamacare) Implementation (Healthcare) - Implementation of the Affordable Care Act aimed at improving healthcare access. - Affected: American citizens - Outcome: Positive; Housing Market Crash and Great Recession (Economic) - Triggered global financial crisis, leading to widespread economic hardship. - Affected: Homeowners, global economy - Outcome: Negative; Charlottesville Rally and Violence (Social Unrest) - Highlighted racial tensions and sparked national debate on hate groups. - Affected: General public, activists - Outcome: Negative; US Recognition of Jerusalem as Israel's Capital (International Policy) - Shifted US foreign policy, leading to global reactions and tensions. - Affected: International community - Outcome: Mixed","Global Financial Crisis, 2007-2008
Arab Spring, 2010-2012
Occupy Wall Street Movement, 2011
Eurozone Crisis, 2009-2013
Syrian Civil War, 2011-present
Russian Military Intervention in Ukraine, 2014-present",,9748.0,175.0,"{""1_stars"":{""reviews_num"":2719,""reviews_percentage"":1},""2_stars"":{""reviews_num"":7956,""reviews_percentage"":4},""3_stars"":{""reviews_num"":39721,""reviews_percentage"":21},""4_stars"":{""reviews_num"":74263,""reviews_percentage"":40},""5_stars"":{""reviews_num"":57921,""reviews_percentage"":31}}",11.99,Secular/Scientific,Anecdotal,Pragmatic/Practical,Case Study Compilation,Underachievement & Stalled Potential,,,,EXTERNAL
Mindset: The New Psychology of Success,"A newer edition of this book can be found here.

After decades of research, world-renowned Stanford University psychologist Carol S. Dweck, Ph.D., discovered a simple but groundbreaking idea: the power of mindset. In this brilliant book, she shows how success in school, work, sports, the arts, and almost every area of human endeavor can be dramatically influenced by how we think about our talents and abilities. People with a fixed mindset — those who believe that abilities are fixed — are less likely to flourish than those with a growth mindset — those who believe that abilities can be developed. Mindset reveals how great parents, teachers, managers, and athletes can put this idea to use to foster outstanding accomplishment.

In this edition, Dweck offers new insights into her now famous and broadly embraced concept. She introduces a phenomenon she calls false growth mindset and guides people toward adopting a deeper, truer growth mindset. She also expands the mindset concept beyond the individual, applying it to the cultures of groups and organizations. With the right mindset, you can motivate those you lead, teach, and love — to transform their lives and your own.",https://www.goodreads.com/book/show/40745.Mindset,https://images-na.ssl-images-amazon.com/images/S/compressed.photo.goodreads.com/books/1436227012i/40745.jpg,40745.Mindset,,,,Carol S. Dweck,58.0,2074.0,,"Carol S. Dweck, Ph.D., is one of the world’s leading researchers in the field of motivation and is the Lewis and Virginia Eaton Professor of Psychology at Stanford University. Her research has focused on why people succeed and how to foster success. She has held professorships at Columbia and Harvard Universities, has lectured all over the world, and has been elected to the American Academy of Arts and Sciences. Her scholarly book Self-Theories: Their Role in Motivation, Personality, and Development was named Book of the Year by the World Education Federation. Her work has been featured in such publications as The New Yorker, Time, The New York Times, The Washington Post, and The Boston Globe, and she has appeared on Today and 20/20.","{""name"":""Carol S. Dweck"",""num_books"":58,""num_followers"":""2074""}","[""Psychology"",""Nonfiction"",""Self Help"",""Business"",""Personal Development"",""Education"",""Leadership"",""Parenting"",""Productivity"",""Audiobook""]","The book addresses the issue of individuals not realizing their full potential due to believing in fixed abilities, and provides guidance on how to cultivate a growth mindset for personal, interpersonal, and professional success.","Fixed mindset, Growth mindset, Potential, Personal development, Professional success.",4.1,153560.0,11164.0,1/1/2006,2006,"September 11 Attacks (Terrorism) - Led to global War on Terror and significant changes in US policies. - Affected: American citizens, global citizens - Outcome: Negative; Hurricane Katrina (Natural Disaster) - One of the deadliest hurricanes in US history, causing widespread destruction and loss of life. - Affected: Gulf Coast residents - Outcome: Negative; Affordable Care Act (Obamacare) Implementation (Healthcare) - Implementation of the Affordable Care Act aimed at improving healthcare access. - Affected: American citizens - Outcome: Positive; Enactment of the Patriot Act (Legislative) - Expanded surveillance powers postUnknown9/11, raising privacy concerns. - Affected: American citizens - Outcome: Mixed; Housing Market Crash and Great Recession (Economic) - Triggered global financial crisis, leading to widespread economic hardship. - Affected: Homeowners, global economy - Outcome: Negative","Dot-com Bubble Burst, 2000-2002
September 11 Attacks, 2001
Global Financial Crisis, 2007-2008
Asian Financial Crisis, 1997-1998
Iraq War, 2003-2011
War in Afghanistan, 2001-Present.",,285.0,312.0,"{""1_stars"":{""reviews_num"":2979,""reviews_percentage"":1},""2_stars"":{""reviews_num"":7472,""reviews_percentage"":4},""3_stars"":{""reviews_num"":26546,""reviews_percentage"":17},""4_stars"":{""reviews_num"":51388,""reviews_percentage"":33},""5_stars"":{""reviews_num"":65175,""reviews_percentage"":42}}",13.99,Secular/Scientific,Research-based,Authoritative,Instructional,Underachievement & Stalled Potential,,,,INTERNAL
Emotional Intelligence: Why It Can Matter More Than IQ,"The groundbreaking book that redefines what it means to be smart, with a new introduction by the author.

Everyone knows that high IQ is no guarantee of success, happiness, or virtue, but until Emotional Intelligence, we could only guess why. Daniel Goleman's brilliant report from the frontiers of psychology and neuroscience offers startling new insight into our “two minds”—the rational and the emotional—and how they together shape our destiny.

Drawing on groundbreaking brain and behavioral research, Goleman shows the factors at work when people of high IQ flounder and those of modest IQ do surprisingly well. These factors, which include self-awareness, self-discipline, and empathy, add up to a different way of being smart—and they aren’t fixed at birth. Although shaped by childhood experiences, emotional intelligence can be nurtured and strengthened throughout our adulthood—with immediate benefits to our health, our relationships, and our work. 
 
The twenty-fifth-anniversary edition of Emotional Intelligence could not come at a better time—we spend so much of our time online, more and more jobs are becoming automated and digitized, and our children are picking up new technology faster than we ever imagined. With a new introduction from the author, the twenty-fifth-anniversary edition prepares readers, now more than ever, to reach their fullest potential and stand out from the pack with the help of EI.",https://www.goodreads.com/book/show/26329.Emotional_Intelligence,https://images-na.ssl-images-amazon.com/images/S/compressed.photo.goodreads.com/books/1388185411i/26329.jpg,26329.Emotional_Intelligence,,,,Daniel Goleman,347.0,5019.0,,"Author of Emotional Intelligence and psychologist Daniel Goleman has transformed the way the world educates children, relates to family and friends, and conducts business. The Wall Street Journal ranked him one of the 10 most influential business thinkers.

Goleman’s Emotional Intelligence was on The New York Times best sellers list for a year-and-a-half. Named one of the 25 ""Most Influential Business Management Books"" by TIME, it has been translated into 40 languages. The Harvard Business Review called emotional intelligence (EI) “a revolutionary, paradigm-shattering idea.”

Goleman’s new book, Focus: The Hidden Driver of Excellence, argues that attention — a fundamental mental ability for success — has come under siege. Leadership that gets results demands a triple focus: on our inner world so we can manage ourselves; on others, for our relationships; and on the outer forces that shape our organizations and society itself.

His more recent books include The Brain and Emotional Intelligence, and Leadership: The Power of Emotional Intelligence - Selected Writings.","{""name"":""Daniel Goleman"",""num_books"":347,""num_followers"":""5019""}","[""Psychology"",""Nonfiction"",""Self Help"",""Business"",""Personal Development"",""Science"",""Leadership"",""Audiobook"",""Management"",""Relationships""]",The book addresses the issue of relying solely on rational intelligence (IQ) for success and presents the concept of emotional intelligence as a significant indicator of personal and professional prosperity.,"Emotional Intelligence, Success, Personal development, Professional growth, Relationships.",4.05,121793.0,4563.0,1/1/1995,1995,"Oklahoma City Bombing (Domestic Terrorism) - Deadliest act of domestic terrorism in the US until 9/11, leading to 168 deaths. - Affected: American citizens - Outcome: Negative; Tech Boom and DotUnknowncom Bubble (Economic) - Rapid growth in tech industry, followed by a market crash in 2000. - Affected: Tech companies, investors - Outcome: Mixed","Industrial Revolution (1760-1840)

World War II (1939-1945)

Cold War (1947–1991)

Globalization (1980s-Present)

The Technological Advancement or Digital Revolution (1970s-Present)","Published in 1995, amid the national shock of the Oklahoma City Bombing and the rapidly evolving tech boom that was reshaping work and communication, the book challenges the notion that IQ is the sole predictor of success by spotlighting how emotional skills are essential for navigating an unpredictable world.",215.0,254.0,"{""1_stars"":{""reviews_num"":2257,""reviews_percentage"":1},""2_stars"":{""reviews_num"":5284,""reviews_percentage"":4},""3_stars"":{""reviews_num"":23324,""reviews_percentage"":19},""4_stars"":{""reviews_num"":44104,""reviews_percentage"":36},""5_stars"":{""reviews_num"":46824,""reviews_percentage"":38}}",12.99,Secular/Scientific,Research-based,Authoritative,Case Study Compilation,Underachievement & Stalled Potential,Individuals Facing Relationship & Family Issues,Self-Defeating Behaviors & Mindsets,Cognitive & Behavioral Techniques,INTERNAL
Drive: The Surprising Truth About What Motivates Us,"The New York Times bestseller that gives readers a paradigm-shattering new way to think about motivation 

Most people believe that the best way to motivate is with rewards like money—the carrot-and-stick approach. That's a mistake, says Daniel H. Pink (author of To Sell Is Human: The Surprising Truth About Motivating Others). In this provocative and persuasive new book, he asserts that the secret to high performance and satisfaction—at work, at school, and at home—is the deeply human need to direct our own lives, to learn and create new things, and to do better by ourselves and our world.

Drawing on four decades of scientific research on human motivation, Pink exposes the mismatch between what science knows and what business does—and how that affects every aspect of life. He examines the three elements of true motivation—autonomy, mastery, and purpose—and offers smart and surprising techniques for putting these into action in a unique book that will change how we think and transform how we live.",https://www.goodreads.com/book/show/6452796-drive,https://images-na.ssl-images-amazon.com/images/S/compressed.photo.goodreads.com/books/1348931599i/6452796.jpg,6452796-drive,,,,Daniel H. Pink,145.0,28653.0,4,"Daniel H. Pink is the author of six provocative books — including his newest, When: The Scientific Secrets of Perfect Timing.

WHEN has spent 4 months on the New York Times bestseller list and was named a Best Book of 2018 by Amazon and iBooks.

Dan's other books include the long-running New York Times bestseller A Whole New Mind and the #1 New York Times bestsellers Drive and To Sell is Human. His books have won multiple awards and have been translated into 39 languages.

He and his wife, who live in Washington, DC, have three children -- a college senior, a college sophomore, and a high school sophomore.","{""name"":""Daniel H. Pink"",""num_books"":145,""num_followers"":""28653""}","[""Nonfiction"",""Business"",""Psychology"",""Leadership"",""Self Help"",""Personal Development"",""Management"",""Productivity"",""Education"",""Audiobook""]","The book addresses the widespread misconception that external rewards like money are the most effective motivators, arguing instead that internal desires for autonomy, mastery, and purpose are the keys to high performance and satisfaction.","Motivation, High performance, Autonomy, Mastery, Purpose.",3.95,119155.0,5472.0,12/29/2009,2009,"Hurricane Katrina (Natural Disaster) - One of the deadliest hurricanes in US history, causing widespread destruction and loss of life. - Affected: Gulf Coast residents - Outcome: Negative; Black Lives Matter Movement (Social Movement) - Movement against violence and systemic racism towards black people. - Affected: African American community - Outcome: Positive; Supreme Court Upholds Obamacare (Judicial) - Affirmed the constitutionality of the Affordable Care Act, ensuring continued health coverage. - Affected: American citizens - Outcome: Positive; Hurricane Sandy (Natural Disaster) - Devastating hurricane causing extensive damage and highlighting climate risks. - Affected: East Coast residents - Outcome: Negative; Affordable Care Act (Obamacare) Implementation (Healthcare) - Implementation of the Affordable Care Act aimed at improving healthcare access. - Affected: American citizens - Outcome: Positive; Housing Market Crash and Great Recession (Economic) - Triggered global financial crisis, leading to widespread economic hardship. - Affected: Homeowners, global economy - Outcome: Negative","Global Financial Crisis, 2007-2008","In the aftermath of the 2007–2008 global financial crisis and housing market crash, Pink’s book offers a timely shift in perspective by arguing that rebuilding personal and economic resilience hinges on internal motivators—autonomy, mastery, and purpose—instead of traditional monetary rewards.",9244.0,225.0,"{""1_stars"":{""reviews_num"":3178,""reviews_percentage"":2},""2_stars"":{""reviews_num"":6125,""reviews_percentage"":5},""3_stars"":{""reviews_num"":24302,""reviews_percentage"":20},""4_stars"":{""reviews_num"":45250,""reviews_percentage"":37},""5_stars"":{""reviews_num"":40300,""reviews_percentage"":33}}",13.99,Secular/Scientific,Research-based,Authoritative,Case Study Compilation,Underachievement & Stalled Potential,Individuals Experiencing Career & Financial Challenges,Self-Defeating Behaviors & Mindsets,Cognitive & Behavioral Techniques,EXTERNAL
