name,summary,url,image_url,id,book_type,is_bt,bt_source,author_clean,author_num_books,author_num_followers,cred_score,author_bio,about_author,genres,problem_sentence,keywords,star_rating,num_ratings,num_reviews,first_published,year_published,usa_events,historical_context,publication_reason,currently_reading,want_to_read,community_reviews,kindle_price_clean,spectrum_clean,methodology_clean,tone_clean,style_clean,key_cat_primary,audience_cat,problem_cat,solution_cat,problem_origin
Black Box Thinking: Why Some People Never Learn from Their Mistakes - But Some Do,"Nobody wants to fail. But in highly complex organizations, success can happen only when we confront our mistakes, learn from our own version of a black box, and create a climate where it’s safe to fail.
　
We all have to endure failure from time to time, whether it’s underperforming at a job interview, flunking an exam, or losing a pickup basketball game. But for people working in safety-critical industries, getting it wrong can have deadly consequences. Consider the shocking fact that preventable medical error is the third-biggest killer in the United States, causing more than 400,000 deaths every year. More people die from mistakes made by doctors and hospitals than from traffic accidents. And most of those mistakes are never made public, because of malpractice settlements with nondisclosure clauses.

For a dramatically different approach to failure, look at aviation. Every passenger aircraft in the world is equipped with an almost indestructible black box. Whenever there’s any sort of mishap, major or minor, the box is opened, the data is analyzed, and experts figure out exactly what went wrong. Then the facts are published and procedures are changed, so that the same mistakes won’t happen again. By applying this method in recent decades, the industry has created an astonishingly good safety record.

Few of us put lives at risk in our daily work as surgeons and pilots do, but we all have a strong interest in avoiding predictable and preventable errors. So why don’t we all embrace the aviation approach to failure rather than the health-care approach? As Matthew Syed shows in this eye-opening book, the answer is rooted in human psychology and organizational culture.

Syed argues that the most important determinant of success in any field is an acknowledgment of failure and a willingness to engage with it. Yet most of us are stuck in a relationship with failure that impedes progress, halts innovation, and damages our careers and personal lives. We rarely acknowledge or learn from failure—even though we often claim the opposite. We think we have 20/20 hindsight, but our vision is usually fuzzy.

Syed draws on a wide range of sources—from anthropology and psychology to history and complexity theory—to explore the subtle but predictable patterns of human error and our defensive responses to error. He also shares fascinating stories of individuals and organizations that have successfully embraced a black box approach to improvement, such as David Beckham, the Mercedes F1 team, and Dropbox.",https://www.goodreads.com/book/show/24611735-black-box-thinking,https://images-na.ssl-images-amazon.com/images/S/compressed.photo.goodreads.com/books/1442833652i/24611735.jpg,24611735-black-box-thinking,,,,Matthew Syed,55.0,491.0,,"Matthew Syed is an author and highly acclaimed speaker in the field of high performance. He has written six bestselling books on the subject of mindset and high performance – Rebel Ideas, Bounce, Black Box Thinking, The Greatest, and his celebrated children’s books, You Are Awesome and The You Are Awesome Journal – and has worked with many leading organisations to build a mindset of continuous improvement. He is also a multi-award-winning journalist for The Times and a regular contributor to television and radio. In his previous career, Matthew was the England table tennis number one for almost a decade.

Matthew’s work explores a thought-provoking approach to high performance in the context of a complex and fast-changing world. By understanding the intimate connection between mindset and high performance, organisations can unlock untapped potential in individuals and teams, driving innovation and agility to secure a future-proofed environment.



Matthew is also co-founder of Matthew Syed Consulting (MSC); the company has worked with an impressive portfolio of clients to build growth mindset cultures and drive higher performance in individuals, teams and organisations. Matthew Syed Consulting’s cutting-edge thought leadership programme and digital learning tools are becoming a catalyst for real and lasting change within business and the public sector.","{""name"":""Matthew Syed"",""num_books"":55,""num_followers"":""491""}","[""Nonfiction"",""Psychology"",""Business"",""Self Help"",""Personal Development"",""Leadership"",""Productivity"",""Audiobook"",""Science"",""Management""]","The book addresses the issue of how failure is often unacknowledged and unlearned from, even when doing so can lead to preventable errors and hinder progress, particularly in complex organizations.","Acknowledging Failure, Learning from Mistakes, Organizational Culture, Human Error, Improvement Approach.",4.29,12761.0,1035.0,9/8/2015,2015,"Black Lives Matter Movement (Social Movement) - Movement against violence and systemic racism towards black people. - Affected: African American community - Outcome: Positive; Supreme Court Upholds Obamacare (Judicial) - Affirmed the constitutionality of the Affordable Care Act, ensuring continued health coverage. - Affected: American citizens - Outcome: Positive; USUnknownMexico Border Wall Expansion (Political/Infrastructure) - Controversial project aimed at curbing illegal immigration and trafficking. - Affected: Migrants, American citizens - Outcome: Mixed; SameUnknownSex Marriage Legalization (Legal) - Supreme Court legalized sameUnknownsex marriage, a landmark decision. - Affected: LGBTQ+ community, citizens - Outcome: Positive; #MeToo Movement (Social Movement) - Movement against sexual harassment and assault, sparking global conversations. - Affected: Survivors, general public - Outcome: Positive; George Floyd Protests and Derek Chauvin Trial (Social Movement/Legal) - Nationwide protests against racial injustice; Derek Chauvin's trial and conviction. - Affected: Black community, citizens - Outcome: Mixed; Hurricane Sandy (Natural Disaster) - Devastating hurricane causing extensive damage and highlighting climate risks. - Affected: East Coast residents - Outcome: Negative; Affordable Care Act (Obamacare) Implementation (Healthcare) - Implementation of the Affordable Care Act aimed at improving healthcare access. - Affected: American citizens - Outcome: Positive; Charlottesville Rally and Violence (Social Unrest) - Highlighted racial tensions and sparked national debate on hate groups. - Affected: General public, activists - Outcome: Negative; US Recognition of Jerusalem as Israel's Capital (International Policy) - Shifted US foreign policy, leading to global reactions and tensions. - Affected: International community - Outcome: Mixed","Global Financial Crisis (2007-2008)

BP Deepwater Horizon Oil Spill (2010)

Fukushima Nuclear Disaster (2011)

Volkswagen Emissions Scandal (2015)","Following high-profile incidents such as the Deepwater Horizon Oil Spill and the Volkswagen Emissions Scandal—which starkly revealed how hidden organizational failures can lead to catastrophic outcomes—this book was published to spark a conversation about openly learning from mistakes, much like the aviation industry's use of a black box approach.",2296.0,265.0,"{""1_stars"":{""reviews_num"":67,""reviews_percentage"":0},""2_stars"":{""reviews_num"":288,""reviews_percentage"":2},""3_stars"":{""reviews_num"":1564,""reviews_percentage"":12},""4_stars"":{""reviews_num"":4761,""reviews_percentage"":37},""5_stars"":{""reviews_num"":6081,""reviews_percentage"":47}}",16.99,Secular/Scientific,Anecdotal,Authoritative,Case Study Compilation,Underachievement & Stalled Potential,Individuals Experiencing Career & Financial Challenges,Self-Defeating Behaviors & Mindsets,Practical Life Management Methods,EXTERNAL
The Outsiders: Eight Unconventional CEOs and Their Radically Rational Blueprint for Success,"”It is impossible to produce superior performance unless you do something different.” — John TempletonWhat makes a successful CEO? Most people call to mind a familiar definition: a seasoned manager with deep industry expertise. Others might point to the qualities of today’s so-called celebrity CEOs—charisma, virtuoso communication skills, and a confident management style. But what really matters when you run an organization? What is the hallmark of exceptional CEO performance? Quite simply, it is the returns for the shareholders of that company over the long term.In this refreshing, counterintuitive book, author Will Thorndike brings to bear the analytical wisdom of a successful career in investing, closely evaluating the performance of companies and their leaders. You will meet eight individualistic CEOs whose firms’ average returns outperformed the S&P 500 by a factor of twenty—in other words, an investment of $10,000 with each of these CEOs, on average, would have been worth over $1.5 million twenty-five years later. You may not know all their names, but you will recognize their companies: General Cinema, Ralston Purina, The Washington Post Company, Berkshire Hathaway, General Dynamics, Capital Cities Broadcasting, TCI, and Teledyne. In The Outsiders, you’ll learn the traits and methods—striking for their consistency and relentless rationality—that helped these unique leaders achieve such exceptional performance.Humble, unassuming, and often frugal, these ""outsiders” shunned Wall Street and the press, and shied away from the hottest new management trends. Instead, they shared specific traits that put them and the companies they led on winning trajectories: a laser-sharp focus on per share value as opposed to earnings or sales growth; an exceptional talent for allocating capital and human resources; and the belief that cash flow, not reported earnings, determines a company’s long-term value.Drawing on years of research and experience, Thorndike tells eye-opening stories, extracting lessons and revealing a compelling alternative model for anyone interested in leading a company or investing in one—and reaping extraordinary returns.",https://www.goodreads.com/book/show/13586932-the-outsiders,https://images-na.ssl-images-amazon.com/images/S/compressed.photo.goodreads.com/books/1393447357i/13586932.jpg,13586932-the-outsiders,Biography,,,William N. Thorndike Jr.,4.0,67.0,3,,"{""name"":""William N. Thorndike Jr."",""num_books"":4,""num_followers"":""67""}","[""Business"",""Finance"",""Nonfiction"",""Leadership"",""Management"",""Entrepreneurship"",""Economics"",""Biography"",""Self Help"",""Buisness""]",The book addresses the challenge of identifying the distinctive traits and methods that can lead to exceptional CEO performance and maximising shareholder returns over the long term.,"CEO performance, shareholder returns, capital allocation, cash flow, leadership traits.",4.22,11797.0,641.0,1/1/2012,2012,"Black Lives Matter Movement (Social Movement) - Movement against violence and systemic racism towards black people. - Affected: African American community - Outcome: Positive; Supreme Court Upholds Obamacare (Judicial) - Affirmed the constitutionality of the Affordable Care Act, ensuring continued health coverage. - Affected: American citizens - Outcome: Positive; USUnknownMexico Border Wall Expansion (Political/Infrastructure) - Controversial project aimed at curbing illegal immigration and trafficking. - Affected: Migrants, American citizens - Outcome: Mixed; SameUnknownSex Marriage Legalization (Legal) - Supreme Court legalized sameUnknownsex marriage, a landmark decision. - Affected: LGBTQ+ community, citizens - Outcome: Positive; #MeToo Movement (Social Movement) - Movement against sexual harassment and assault, sparking global conversations. - Affected: Survivors, general public - Outcome: Positive; Hurricane Sandy (Natural Disaster) - Devastating hurricane causing extensive damage and highlighting climate risks. - Affected: East Coast residents - Outcome: Negative; Affordable Care Act (Obamacare) Implementation (Healthcare) - Implementation of the Affordable Care Act aimed at improving healthcare access. - Affected: American citizens - Outcome: Positive; Housing Market Crash and Great Recession (Economic) - Triggered global financial crisis, leading to widespread economic hardship. - Affected: Homeowners, global economy - Outcome: Negative; Charlottesville Rally and Violence (Social Unrest) - Highlighted racial tensions and sparked national debate on hate groups. - Affected: General public, activists - Outcome: Negative; US Recognition of Jerusalem as Israel's Capital (International Policy) - Shifted US foreign policy, leading to global reactions and tensions. - Affected: International community - Outcome: Mixed","Global Financial Crisis (2007-2008)
Occupy Wall Street Movement (2011)
Enron Scandal (2001)
Dot-com Bubble Burst (2000-2002)
Corporate Accounting Scandals (2001-2002)
Worldcom Scandal (2002)","Amid lingering concerns from the Global Financial Crisis and growing public scrutiny of corporate leadership during Occupy Wall Street, The Outsiders was published to challenge traditional management models by highlighting how unconventional, disciplinarian CEOs achieved exceptional long-term shareholder returns.",1760.0,293.0,"{""1_stars"":{""reviews_num"":194,""reviews_percentage"":1},""2_stars"":{""reviews_num"":406,""reviews_percentage"":3},""3_stars"":{""reviews_num"":1652,""reviews_percentage"":14},""4_stars"":{""reviews_num"":3939,""reviews_percentage"":33},""5_stars"":{""reviews_num"":5606,""reviews_percentage"":47}}",15.44,Secular/Scientific,Experiential,Motivational/Inspirational,Memoir/Biographical,Underachievement & Stalled Potential,Individuals Experiencing Career & Financial Challenges,Financial & Career Hardships,Practical Life Management Methods,INTERNAL
"The 4-Hour Chef: The Simple Path to Cooking Like a Pro, Learning Anything, and Living the Good Life","“If you crossed Jason Bourne with Julia Child, you’d end up with Tim Ferriss.” – Marco Canora, Chef-Partner of Hearth & Terroir

“Wildly inventive.. [a] rangy, obsessive immersion in food and its many wonders. [T]he tools needed to learn to cook well can be deployed in every manner of endeavor, from skinning a deer to memorizing a deck of cards. The author distills them into minimal, learnable units and examines how to order the units so as to keep readers engaged in their endeavors. Ferriss is a beguiling guide to this process, at once charmingly smart aleck-y and deadly serious, and he aims to make readers knowledgeable and freethinking.” - Kirkus Reviews

""Tim Ferriss distills kitchen wisdom like a rotary evaporator on power surge. The results are potent, lucid, and delicious."" - Nick Kokonas, Co-Owner, Alinea, Next, The Aviary

WHAT IF YOU COULD BECOME WORLD-CLASS IN ANYTHING IN 6 MONTHS OR LESS? 

The 4-Hour Chef isn’t just a cookbook. It’s a choose-your-own-adventure guide to the world of rapid learning.

#1 New York Times bestselling author (and lifelong non-cook) Tim Ferriss takes you from Manhattan to Okinawa, and from Silicon Valley to Calcutta, unearthing the secrets of the world’s fastest learners and greatest chefs. Ferriss uses cooking to explain “meta-learning,” a step-by-step process that can be used to master anything, whether searing steak or shooting 3-pointers in basketball. That is the real “recipe” of The 4-Hour Chef.

You'll train inside the kitchen for everything outside the kitchen. Featuring tips and tricks from chess prodigies, world-renowned chefs, pro athletes, master sommeliers, super models, and everyone in between, this “cookbook for people who don’t buy cookbooks” is a guide to mastering cooking and life. 

The 4-Hour Chef is a five-stop journey through the art and science of learning: 

1. META-LEARNING. Before you learn to cook, you must learn to learn. META charts the path to doubling your learning potential.

2. THE DOMESTIC. DOM is where you learn the building blocks of cooking. These are the ABCs (techniques) that can take you from Dr, Seuss to Shakespeare. 

3. THE WILD. Becoming a master student requires self-sufficiency in all things. WILD teaches you to hunt, forage, and survive.

4. THE SCIENTIST. SCI is the mad scientist and modernist painter wrapped into one. This is where you rediscover whimsy and wonder.

5. THE PROFESSIONAL. Swaraj, a term usually associated with Mahatma Gandhi, can be translated as “self-rule.” In PRO, we’ll look at how the best in the world become the best in the world, and how you can chart your own path far beyond this book.",https://www.goodreads.com/book/show/13129810-the-4-hour-chef,https://images-na.ssl-images-amazon.com/images/S/compressed.photo.goodreads.com/books/1349156708i/13129810.jpg,13129810-the-4-hour-chef,Cookbooks,,,Timothy Ferriss,58.0,10211.0,3,"Tim Ferriss is author of three #1 NYT/WSJ bestsellers: The 4-Hour Workweek, The 4-Hour Body, and The 4-Hour Chef. He is also a start-up advisor specializing in positioning, PR, and marketing (Uber, Evernote, etc.). When not damaging his body with abusive sports, he enjoys chocolate, bear claws, and Japanese animation.","{""name"":""Timothy Ferriss"",""num_books"":58,""num_followers"":""10211""}","[""Nonfiction"",""Cooking"",""Food"",""Self Help"",""Cookbooks"",""Personal Development"",""Health"",""Productivity"",""Reference"",""Business""]","The book addresses the challenge of maximizing individual potential, using cooking as a platform to demonstrate how to efficiently and effectively learn and master any skill.","Rapid learning, Mastery, Self-development, Efficiency, Skill acquisition.",3.94,10771.0,500.0,1/1/2012,2012,"Black Lives Matter Movement (Social Movement) - Movement against violence and systemic racism towards black people. - Affected: African American community - Outcome: Positive; Supreme Court Upholds Obamacare (Judicial) - Affirmed the constitutionality of the Affordable Care Act, ensuring continued health coverage. - Affected: American citizens - Outcome: Positive; USUnknownMexico Border Wall Expansion (Political/Infrastructure) - Controversial project aimed at curbing illegal immigration and trafficking. - Affected: Migrants, American citizens - Outcome: Mixed; SameUnknownSex Marriage Legalization (Legal) - Supreme Court legalized sameUnknownsex marriage, a landmark decision. - Affected: LGBTQ+ community, citizens - Outcome: Positive; #MeToo Movement (Social Movement) - Movement against sexual harassment and assault, sparking global conversations. - Affected: Survivors, general public - Outcome: Positive; Hurricane Sandy (Natural Disaster) - Devastating hurricane causing extensive damage and highlighting climate risks. - Affected: East Coast residents - Outcome: Negative; Affordable Care Act (Obamacare) Implementation (Healthcare) - Implementation of the Affordable Care Act aimed at improving healthcare access. - Affected: American citizens - Outcome: Positive; Housing Market Crash and Great Recession (Economic) - Triggered global financial crisis, leading to widespread economic hardship. - Affected: Homeowners, global economy - Outcome: Negative; Charlottesville Rally and Violence (Social Unrest) - Highlighted racial tensions and sparked national debate on hate groups. - Affected: General public, activists - Outcome: Negative; US Recognition of Jerusalem as Israel's Capital (International Policy) - Shifted US foreign policy, leading to global reactions and tensions. - Affected: International community - Outcome: Mixed","Global Financial Crisis (2008-2012)
Rise of Social Media Influence (2005-Present)
Rapid Technological Advancements (2000s-Present)","Amid the lingering effects of the Global Financial Crisis and the accelerating influence of social media in disseminating innovative ideas, The 4-Hour Chef was published in 2012 to empower readers with rapid, efficient learning techniques that could help them adapt and thrive in an ever-changing world.",1916.0,167.0,"{""1_stars"":{""reviews_num"":230,""reviews_percentage"":2},""2_stars"":{""reviews_num"":604,""reviews_percentage"":5},""3_stars"":{""reviews_num"":2340,""reviews_percentage"":21},""4_stars"":{""reviews_num"":3969,""reviews_percentage"":36},""5_stars"":{""reviews_num"":3628,""reviews_percentage"":33}}",,Secular/Scientific,Step-by-step,Pragmatic/Practical,Instructional,Underachievement & Stalled Potential,Individuals Experiencing Career & Financial Challenges,Self-Defeating Behaviors & Mindsets,Practical Life Management Methods,INTERNAL
