name,summary,url,image_url,id,book_type,is_bt,bt_source,author_clean,author_num_books,author_num_followers,cred_score,author_bio,about_author,genres,problem_sentence,keywords,star_rating,num_ratings,num_reviews,first_published,year_published,usa_events,historical_context,publication_reason,currently_reading,want_to_read,community_reviews,kindle_price_clean,spectrum_clean,methodology_clean,tone_clean,style_clean,key_cat_primary,audience_cat,problem_cat,solution_cat,problem_origin
Show Your Work!: 10 Ways to Share Your Creativity and Get Discovered,"In his New York Times bestseller Steal Like an Artist, Austin Kleon showed readers how to unlock their creativity by “stealing” from the community of other movers and shakers. Now, in an even more forward-thinking and necessary book, he shows how to take that critical next step on a creative journey—getting known. Show Your Work! is about why generosity trumps genius. It’s about getting findable, about using the network instead of wasting time “networking.” It’s not self-promotion, it’s self-discovery—let others into your process, then let them steal from you. Filled with illustrations, quotes, stories, and examples, Show Your Work! offers ten transformative rules for being open, generous, brave, productive. In chapters such as You Don’t Have to Be a Genius; Share Something Small Every Day; and Stick Around, Kleon creates a user’s manual for embracing the communal nature of creativity— what he calls the “ecology of talent.” From broader life lessons about work (you can’t find your voice if you don’t use it) to the etiquette of sharing—and the dangers of oversharing—to the practicalities of Internet life (build a good domain name; give credit when credit is due), it’s an inspiring manifesto for succeeding as any kind of artist or entrepreneur in the digital age.",https://www.goodreads.com/book/show/18290401-show-your-work,https://images-na.ssl-images-amazon.com/images/S/compressed.photo.goodreads.com/books/1404580714i/18290401.jpg,18290401-show-your-work,,,,Austin Kleon,21.0,6094.0,2,I’m a writer who draws. I make art with words and books with pictures. Author of Steal Like An Artist and other bestsellers. Visit my website: http://austinkleon.com/,"{""name"":""Austin Kleon"",""num_books"":21,""num_followers"":""6094""}","[""Nonfiction"",""Art"",""Self Help"",""Business"",""Design"",""Writing"",""Productivity"",""Personal Development"",""Entrepreneurship"",""Art Design""]",The book addresses the challenge of gaining visibility and recognition in the digital age by integrating one's creative process within the wider community of artists and entrepreneurs.,"Visibility, Recognition, Creative Process, Digital Age, Community Integration.",4.12,52182.0,3975.0,3/6/2014,2014,"Black Lives Matter Movement (Social Movement) - Movement against violence and systemic racism towards black people. - Affected: African American community - Outcome: Positive; Supreme Court Upholds Obamacare (Judicial) - Affirmed the constitutionality of the Affordable Care Act, ensuring continued health coverage. - Affected: American citizens - Outcome: Positive; USUnknownMexico Border Wall Expansion (Political/Infrastructure) - Controversial project aimed at curbing illegal immigration and trafficking. - Affected: Migrants, American citizens - Outcome: Mixed; SameUnknownSex Marriage Legalization (Legal) - Supreme Court legalized sameUnknownsex marriage, a landmark decision. - Affected: LGBTQ+ community, citizens - Outcome: Positive; #MeToo Movement (Social Movement) - Movement against sexual harassment and assault, sparking global conversations. - Affected: Survivors, general public - Outcome: Positive; Hurricane Sandy (Natural Disaster) - Devastating hurricane causing extensive damage and highlighting climate risks. - Affected: East Coast residents - Outcome: Negative; Affordable Care Act (Obamacare) Implementation (Healthcare) - Implementation of the Affordable Care Act aimed at improving healthcare access. - Affected: American citizens - Outcome: Positive; Charlottesville Rally and Violence (Social Unrest) - Highlighted racial tensions and sparked national debate on hate groups. - Affected: General public, activists - Outcome: Negative; US Recognition of Jerusalem as Israel's Capital (International Policy) - Shifted US foreign policy, leading to global reactions and tensions. - Affected: International community - Outcome: Mixed","Rise of Social Media Platforms (2004-2014)
Global Financial Crisis (2008)
Growing Popularity of Digital Marketing (2010-2014)","Published in 2014 as digital marketing surged and social media platforms reshaped personal branding, Show Your Work! offered creatives a timely roadmap to build genuine visibility by sharing their process in an increasingly connected world.",4948.0,817.0,"{""1_stars"":{""reviews_num"":1194,""reviews_percentage"":2},""2_stars"":{""reviews_num"":2053,""reviews_percentage"":3},""3_stars"":{""reviews_num"":8462,""reviews_percentage"":16},""4_stars"":{""reviews_num"":18078,""reviews_percentage"":34},""5_stars"":{""reviews_num"":22395,""reviews_percentage"":42}}",9.99,Secular/Scientific,Anecdotal,Motivational/Inspirational,Instructional,Underachievement & Stalled Potential,Individuals Experiencing Career & Financial Challenges,Financial & Career Hardships,Practical Life Management Methods,EXTERNAL
The Dip: A Little Book That Teaches You When to Quit,"  A New York Times , USA Today , and Wall Street Journal bestseller

In this iconic bestseller, popular business blogger and bestselling author Seth Godin proves that winners are really just the best quitters. Godin shows that winners quit fast, quit often, and quit without guilt—until they commit to beating the right Dip.

Every new project (or job, or hobby, or company) starts out fun…then gets really hard, and not much fun at all. You might be in a Dip—a temporary setback that will get better if you keep pushing. But maybe it’s really a Cul-de-Sac—a total dead end. What really sets superstars apart is the ability to tell the two apart.

Winners seek out the Dip. They realize that the bigger the barrier, the bigger the reward for getting past it. If you can beat the Dip to be the best, you’ll earn profits, glory, and long-term security.
Whether you’re an intern or a CEO, this fun little book will help you figure out if you’re in a Dip that’s worthy of your time, effort, and talents. The old saying is wrong—winners do quit, and quitters do win.",https://www.goodreads.com/book/show/324748.The_Dip,https://images-na.ssl-images-amazon.com/images/S/compressed.photo.goodreads.com/books/1311282216i/324748.jpg,324748.The_Dip,,,,Seth Godin,146.0,6179.0,3,"Seth W. Godin, also known as ""F. X. Nine"", is an American author and a former dot com business executive.","{""name"":""Seth Godin"",""num_books"":146,""num_followers"":""6179""}","[""Business"",""Nonfiction"",""Self Help"",""Personal Development"",""Psychology"",""Leadership"",""Productivity"",""Entrepreneurship"",""Buisness"",""Philosophy""]","The book addresses the problem of identifying and pushing through difficult times in various pursuits, differentiating between transient setbacks that require perseverance (the Dip) and total dead-ends that warrant quitting (the Cul-de-Sac).","Perseverance, Quitting, Decision-Making, Dead Ends, Overcoming Obstacles.",3.79,35369.0,2583.0,1/1/2007,2007,"Hurricane Katrina (Natural Disaster) - One of the deadliest hurricanes in US history, causing widespread destruction and loss of life. - Affected: Gulf Coast residents - Outcome: Negative; Supreme Court Upholds Obamacare (Judicial) - Affirmed the constitutionality of the Affordable Care Act, ensuring continued health coverage. - Affected: American citizens - Outcome: Positive; Hurricane Sandy (Natural Disaster) - Devastating hurricane causing extensive damage and highlighting climate risks. - Affected: East Coast residents - Outcome: Negative; Affordable Care Act (Obamacare) Implementation (Healthcare) - Implementation of the Affordable Care Act aimed at improving healthcare access. - Affected: American citizens - Outcome: Positive; Housing Market Crash and Great Recession (Economic) - Triggered global financial crisis, leading to widespread economic hardship. - Affected: Homeowners, global economy - Outcome: Negative","Global Financial Crisis, 2007-2008
Dot-Com Bubble Burst, 2000-2002
September 11 attacks, 2001
Iraq War, 2003-2011
Hurricane Katrina, 2005
SARS outbreak, 2003","Published at a time when America was grappling with early signs of the global financial crisis and still recovering from the disruptive impacts of Hurricane Katrina, Godin's book provided a timely guide for discerning when to persevere and when to quit in the face of mounting challenges.",1780.0,63.0,"{""1_stars"":{""reviews_num"":1037,""reviews_percentage"":2},""2_stars"":{""reviews_num"":2868,""reviews_percentage"":8},""3_stars"":{""reviews_num"":9006,""reviews_percentage"":25},""4_stars"":{""reviews_num"":11967,""reviews_percentage"":33},""5_stars"":{""reviews_num"":10491,""reviews_percentage"":29}}",8.99,Secular/Scientific,Experiential,Authoritative,Case Study Compilation,Underachievement & Stalled Potential,Individuals Experiencing Career & Financial Challenges,Self-Defeating Behaviors & Mindsets,Practical Life Management Methods,INTERNAL
"Unlimited Memory: How to Use Advanced Learning Strategies to Learn Faster, Remember More and be More Productive","Kevin Horsley Broke a World Memory Record in 2013...And You're About to Learn How to Use His Memory Strategies to Learn Faster, Be More Productive, and Achieve More SuccessWith over 300,000 copies sold, Unlimited Memory is a Wall Street Journal Best Seller and has been the #1 memory book on Amazon for more than two years. It has been translated into more than a dozen languages including French, Chinese, Russian, Korean, Ukrainian, and Lithuanian.Most people never tap into 10% of their potential for memory.In this book, you're about to How the World's Top Memory Experts Concentrate and Remember Any Information at Will, and How You Can TooDo you ever feel like you're too busy, too stressed or just too distracted to concentrate and get work done?In Unlimited Memory, you'll learn how the world's best memory masters get themselves to concentrate at will, anytime they want. When you can easily focus and concentrate on the task at hand, and store and recall useful information, you can easily double your productivity and eliminate wasted time, stress and mistakes at work.You'll find all the tools, strategies and techniques you need to improve your memory. Here’s just a taste of the memory methods you'll  3 bad habits that keep you from easily remembering important informationHow a simple pattern of thinking can stop you from imprinting and remembering key facts, figures and ideas, and how to break this old pattern so you’ll never again be known as someone with a “bad memory”How to master your attention so you can focus and concentrate longer, even during challenging or stressful situationsHow to use your car to remember anything you want (like long lists or information you need to remember for your studies or personal life) without writing anything downSimple methods that allow you to nail down tough information or complex concepts quickly and easilyHow to combine your long-term memory (things you already know and will never forget) and short-term memory (information you want to remember right now) to create instant recall for tests, presentations and important projectsThe simple, invisible mental technique for remembering names without social awkwardness or anxietyHow using your imagination to bring boring information to life can help you dramatically improve your attention span and recallAn incredible strategy for remembering numbers (the same system Kevin used to remember Pi to 10,000 digits and beat the world memory record by 14 minutes)How to use a mental map to lock in and connect hundreds or even thousands of ideas in your long-term memory (this method will allow you to become a leading expert in your field faster than you ever dreamed possible)If you're ready to harness the incredible power of your mind to remember more in less time, this book is for you.About the AuthorFor over 25 years, Kevin Horsley has been analyzing the mind and memory and its capacity for brilliance. He is one of only a few people in the world to have received the title of International Grandmaster of Memory. He is a World Memory Championship medalist, and a two-time World Record holder for The Everest of memory tests.",https://www.goodreads.com/book/show/20958539-unlimited-memory,https://images-na.ssl-images-amazon.com/images/S/compressed.photo.goodreads.com/books/1428170961i/20958539.jpg,20958539-unlimited-memory,,,,Kevin Horsley,11.0,98.0,4,,"{""name"":""Kevin Horsley"",""num_books"":11,""num_followers"":""98""}","[""Self Help"",""Nonfiction"",""Psychology"",""Personal Development"",""Productivity"",""Science"",""Business"",""Education"",""Brain"",""Health""]","The book addresses the common issue of people's inability to tap into their full memory potential, impacting productivity and learning capabilities.","Memory optimization, Concentration, Productivity, Learning techniques, Brain potential",4.01,21542.0,1380.0,1/26/2014,2014,"Black Lives Matter Movement (Social Movement) - Movement against violence and systemic racism towards black people. - Affected: African American community - Outcome: Positive; Supreme Court Upholds Obamacare (Judicial) - Affirmed the constitutionality of the Affordable Care Act, ensuring continued health coverage. - Affected: American citizens - Outcome: Positive; USUnknownMexico Border Wall Expansion (Political/Infrastructure) - Controversial project aimed at curbing illegal immigration and trafficking. - Affected: Migrants, American citizens - Outcome: Mixed; SameUnknownSex Marriage Legalization (Legal) - Supreme Court legalized sameUnknownsex marriage, a landmark decision. - Affected: LGBTQ+ community, citizens - Outcome: Positive; #MeToo Movement (Social Movement) - Movement against sexual harassment and assault, sparking global conversations. - Affected: Survivors, general public - Outcome: Positive; Hurricane Sandy (Natural Disaster) - Devastating hurricane causing extensive damage and highlighting climate risks. - Affected: East Coast residents - Outcome: Negative; Affordable Care Act (Obamacare) Implementation (Healthcare) - Implementation of the Affordable Care Act aimed at improving healthcare access. - Affected: American citizens - Outcome: Positive; Charlottesville Rally and Violence (Social Unrest) - Highlighted racial tensions and sparked national debate on hate groups. - Affected: General public, activists - Outcome: Negative; US Recognition of Jerusalem as Israel's Capital (International Policy) - Shifted US foreign policy, leading to global reactions and tensions. - Affected: International community - Outcome: Mixed","Global Financial Crisis 2008-2009
Rise of Smartphone Usage - 2007 onwards
Advancement in Digital Technology - Throughout Early 2000s
Social Media Boom - 2004 onwards","In 2014, as the U.S. witnessed landmark events like the Supreme Court upholding Obamacare and the rise of the #MeToo movement—which both underscored a national focus on individual rights and personal empowerment—Unlimited Memory was published to help readers harness untapped cognitive potential and boost productivity in a rapidly shifting, high-pressure environment.",27.0,384.0,"{""1_stars"":{""reviews_num"":887,""reviews_percentage"":4},""2_stars"":{""reviews_num"":1370,""reviews_percentage"":6},""3_stars"":{""reviews_num"":3592,""reviews_percentage"":16},""4_stars"":{""reviews_num"":6556,""reviews_percentage"":30},""5_stars"":{""reviews_num"":9137,""reviews_percentage"":42}}",9.99,Secular/Scientific,Experiential,Motivational/Inspirational,Narrative-Driven,Underachievement & Stalled Potential,Individuals Experiencing Career & Financial Challenges,Self-Defeating Behaviors & Mindsets,Cognitive & Behavioral Techniques,INTERNAL
How to Fail at Almost Everything and Still Win Big: Kind of the Story of My Life,"Scott Adams has likely failed at more things than anyone you’ve ever met or anyone you’ve even heard of. So how did he go from hapless office worker and serial failure to the creator of Dilbert, one of the world’s most famous syndicated comic strips, in just a few years? In How to Fail at Almost Everything and Still Win Big, Adams shares the strategy he has used since he was a teen to invite failure in, to embrace it, then pick its pocket. 

No career guide can offer advice for success that works for everyone. As Adams explains, your best bet is to study the ways of others who made it big and try to glean some tricks and strategies that make sense for you. Adams pulls back the covers on his own unusual life and shares what he learned for turning one failure after another into something good and lasting. Adams reveals that he failed at just about everything he’s tried, including his corporate career, his inventions, his investments, and his two restaurants. But there’s a lot to learn from his personal story, and a lot of humor along the way. While it’s hard for anyone to recover from a personal or professional failure, Adams discovered some unlikely truths that helped to propel him forward. For instance:

• Goals are for losers. Systems are for winners.
• ""Passion"" is bull. What you need is personal energy.
• A combination of mediocre skills can make you surprisingly valuable.
• You can manage your odds in a way that makes you look lucky to others.",https://www.goodreads.com/book/show/17859574-how-to-fail-at-almost-everything-and-still-win-big,https://images-na.ssl-images-amazon.com/images/S/compressed.photo.goodreads.com/books/1369823209i/17859574.jpg,17859574-how-to-fail-at-almost-everything-and-still-win-big,"Memoir, Biography",,,Scott Adams,253.0,1217.0,3,"Librarian Note: There is more than one author in the Goodreads database with this name. See this thread for more information.

Adams was born in Windham, New York in 1957 and received his Bachelor's degree in Economics from Hartwick College in 1979.

He also studied economics and management for his 1986 MBA from the Haas School of Business at the University of California, Berkeley.

In recent years, Adams has been hurt with a series of debilitating health problems. Since late 2004, he has suffered from a reemergence of his focal dystonia which has affected his drawing. He can fool his brain by drawing using a graphics tablet. On December 12, 2005, Adams announced on his blog that he also suffers from spasmodic dysphonia, a condition that causes the vocal cords to behave in an abnormal manner. However, on October 24, 2006, he again blogged stating that he had recovered from this condition, although he is unsure if the recovery is permanent. He claims to have developed a method to work around the disorder and has been able to speak normally since. Also, on January 21, 2007, he posted a blog entry detailing his experiences with treatment by Dr. Morton Cooper.

Adams is also a trained hypnotist, as well as a vegetarian. (Mentioned in, ""Dilbert: A Treasury of Sunday Strips 00).

He married Shelly Miles on July 22, 2006.","{""name"":""Scott Adams"",""num_books"":253,""num_followers"":""1217""}","[""Nonfiction"",""Self Help"",""Business"",""Biography"",""Personal Development"",""Psychology"",""Humor"",""Productivity"",""Memoir"",""Audiobook""]","The book addresses how to navigate and learn from failure, draw value from mediocre skills, manage personal energy, and create systems for success, in order to achieve personal and professional growth.","Failure, Success Systems, Personal Energy, Mediocre Skills, Personal and Professional Growth.",4.06,19438.0,1844.0,10/22/2013,2013,"Black Lives Matter Movement (Social Movement) - Movement against violence and systemic racism towards black people. - Affected: African American community - Outcome: Positive; Supreme Court Upholds Obamacare (Judicial) - Affirmed the constitutionality of the Affordable Care Act, ensuring continued health coverage. - Affected: American citizens - Outcome: Positive; USUnknownMexico Border Wall Expansion (Political/Infrastructure) - Controversial project aimed at curbing illegal immigration and trafficking. - Affected: Migrants, American citizens - Outcome: Mixed; SameUnknownSex Marriage Legalization (Legal) - Supreme Court legalized sameUnknownsex marriage, a landmark decision. - Affected: LGBTQ+ community, citizens - Outcome: Positive; #MeToo Movement (Social Movement) - Movement against sexual harassment and assault, sparking global conversations. - Affected: Survivors, general public - Outcome: Positive; Hurricane Sandy (Natural Disaster) - Devastating hurricane causing extensive damage and highlighting climate risks. - Affected: East Coast residents - Outcome: Negative; Affordable Care Act (Obamacare) Implementation (Healthcare) - Implementation of the Affordable Care Act aimed at improving healthcare access. - Affected: American citizens - Outcome: Positive; Housing Market Crash and Great Recession (Economic) - Triggered global financial crisis, leading to widespread economic hardship. - Affected: Homeowners, global economy - Outcome: Negative; Charlottesville Rally and Violence (Social Unrest) - Highlighted racial tensions and sparked national debate on hate groups. - Affected: General public, activists - Outcome: Negative; US Recognition of Jerusalem as Israel's Capital (International Policy) - Shifted US foreign policy, leading to global reactions and tensions. - Affected: International community - Outcome: Mixed","Global Financial Crisis, 2007-2008
Great Recession, 2008-2013
European Sovereign Debt Crisis, 2009-2013
Arab Spring, 2010-2012
Occupy Movement, 2011-2012","Published in 2013 amid the lingering economic challenges of the Great Recession and the transformative implementation of Obamacare, this book offered unconventional strategies for turning failures into success when both personal fortunes and national policies were in flux.",2934.0,372.0,"{""1_stars"":{""reviews_num"":423,""reviews_percentage"":2},""2_stars"":{""reviews_num"":953,""reviews_percentage"":4},""3_stars"":{""reviews_num"":3315,""reviews_percentage"":17},""4_stars"":{""reviews_num"":7174,""reviews_percentage"":36},""5_stars"":{""reviews_num"":7573,""reviews_percentage"":38}}",3.37,Secular/Scientific,Anecdotal,Humorous,Memoir/Biographical,Underachievement & Stalled Potential,Individuals Experiencing Career & Financial Challenges,Financial & Career Hardships,Practical Life Management Methods,INTERNAL
